<?xml version="1.0" encoding="UTF-8"?>
<?xml-stylesheet type="text/xsl" href="students.xsl"?>
<students xmlns="http://www.uts.edu.au/31284/wsd-students"
       xmlns:xsi="http://www.w3.org/2001/XMLSchema-instance"
       xsi:schemaLocation="http://www.uts.edu.au/31284/wsd-students students.xsd">
    <student>
        <firstname>Rico</firstname>
        <lastname>Vico</lastname>
        <email>rico@gmail.com</email>
        <password>123456</password>
        <dateofbirth>1998-09-09</dateofbirth>
        <usertype>student</usertype>
    </student>
    <student>
        <firstname>Jason</firstname>
        <lastname>Goh</lastname>
        <email>jason@gmail.com</email>
        <password>Digdasd@</password>
        <dateofbirth>1997-10-02</dateofbirth>
        <usertype>student</usertype>
    </student>
    <student>
        <firstname>Kaho</firstname>
        <lastname>Poon</lastname>
        <email>kaho@gmail.com</email>
        <password>39289481fmfas@^1</password>
        <dateofbirth>1996-01-21</dateofbirth>
        <usertype>student</usertype>
    </student>
    <student>
        <firstname>Alviandy</firstname>
        <lastname>Gouw</lastname>
        <email>alviandy@gmail.com</email>
        <password>85218*2813</password>
        <dateofbirth>1998-11-03</dateofbirth>
        <usertype>student</usertype> 
    </student>
    <student>
        <firstname>Deddy</firstname>
        <lastname>Tanjaya</lastname>
        <email>deddy@gmail.com</email>
        <password>da0s94k</password>
        <dateofbirth>1998-04-21</dateofbirth>
        <usertype>student</usertype>
    </student>
</students>
